{
  "candidate_knowledge_ids": [],
  "conflict_event_ids": [],
  "created_at": "2026-09-08T17:06:02.303350+00:00",
  "execution_metric_id": "ui_ux_1_201_post_direction_oci_execution_metric",
  "learning_event_id": "ui_ux_1_201_post_direction_oci_learning_event",
  "learning_status": "NO_LEARNING_FOUND",
  "loop_id": "ui_ux_1_201_post_direction_oci_loop",
  "loop_steps": [
    "EXECUTE",
    "VALIDATE",
    "CAPTURE",
    "DISTILL",
    "ASSESS",
    "STORE",
    "COMPILE_NEXT"
  ],
  "mission_id": "ui_ux_1_201_post_direction_microcopy_review_and_oci_feedback",
  "next_mission_id": "ui_ux_1_202_next_visual_block_selection_post_microcopy_closure",
  "next_pack_id": "gokv.pack.247d953d36141636",
  "schema_version": "gokv.post_block_learning_loop.v1"
}
