{
  "candidate_knowledge_ids": [],
  "conflict_event_ids": [],
  "created_at": "2026-09-08T16:10:37.076505+00:00",
  "execution_metric_id": "ui_ux_1_200_first_normal_oci_execution_metric",
  "learning_event_id": "ui_ux_1_200_first_normal_oci_learning_event",
  "learning_status": "NO_LEARNING_FOUND",
  "loop_id": "ui_ux_1_200_first_normal_oci_loop",
  "loop_steps": [
    "EXECUTE",
    "VALIDATE",
    "CAPTURE",
    "DISTILL",
    "ASSESS",
    "STORE",
    "COMPILE_NEXT"
  ],
  "mission_id": "ui_ux_1_200",
  "next_mission_id": "ui_ux_1_201",
  "next_pack_id": null,
  "schema_version": "gokv.post_block_learning_loop.v1"
}
