{
  "loop_id": "roadmap_3_0_backend_elite_read_only_audit_loop",
  "schema_version": "gokv.post_block_learning_loop.v1",
  "mission_id": "roadmap_3_0_backend_elite_read_only_inventory",
  "learning_status": "NO_LEARNING_FOUND",
  "learning_event_id": "roadmap_3_0_backend_elite_read_only_audit_learning_event",
  "execution_metric_id": "roadmap_3_0_backend_elite_read_only_audit_execution_metric",
  "candidate_knowledge_ids": [],
  "conflict_event_ids": [],
  "next_mission_id": "roadmap_3_1_security_permission_activation_boundary_read_only_audit",
  "next_pack_id": "gokv.pack.112d1122146ee5c3",
  "loop_steps": ["EXECUTE","VALIDATE","CAPTURE","DISTILL","ASSESS","STORE","COMPILE_NEXT"],
  "created_at": "2026-09-08T23:12:47Z"
}
